{
  "$schema": "https://cccarrrottt.github.io/chart.schema.json",
  "format": 4,
  "nodes": [
    {"id":"uprising","label":"{{#cc22cc|{{u:solid|Beast Wars: }}}}{{u:solid|[[Upris|{{z:20|readin}}g]]ing}}{{s:images}}{{u:solid|фыву}}","parent":["split","asdasd-1-copy"],"pos":[-100.3,-41.93],"colors":["#20242b"],"square":true},
    {"id":"uprising-copy","label":"Beast Wars: Uprising","parent":"uprising","pos":[292.98,62.71],"colors":["#20242b"],"border":"dashdot"},
    {"id":"asdasd","label":"asda{{u:double|sdи}}","note":"{{m:nagahurt}}","pos":[-206.74,98.62],"colors":["#20242b","#c2c"],"tags":["local multiverse","fan-fiction","multiversal hub"],"border":"wavy","size":[50.35,20.14],"decor":"wavy"},
    {"id":"asdasd-copy","label":"asdasd","parent":"asdasd","pos":[-122.41,92.29],"border":"dashdot"},
    {"id":"beast-wars-uprising-copy","label":"Beast Wars: Uprising","pos":[-272.21,297.28],"tags":["fan-fiction"],"colors":["#20242b"],"square":true},
    {"id":"beast-wars-uprising-copy-2","label":"Beast Wars: Uprising","pos":[-100.95,297.21],"colors":["#22cc"],"square":true,"link":"https://cccarrrottt.github.io/#entry=beast-wars-uprising-copy-3"},
    {"id":"beast-wars-uprising-copy-3","label":"Beast Wars: Uprising","pos":[16.89,297.28],"colors":["#20242b"],"square":true},
    {"id":"beast-wars-uprising-copy-4","label":"Beast Wars: Uprising","parent":"asdasd-copy","pos":[168.98,297.28],"colors":["#2c2"],"square":true},
    {"id":"beast-wars-uprising-copy-5","label":"Beast Wars: Uprising","parent":["beast-wars-uprising-copy","beast-wars-uprising-copy-2","beast-wars-uprising-copy-3","beast-wars-uprising-copy-4","beast-wars-uprising-copy-6"],"pos":[-43.53,360.72],"square":true,"border":"dotted","bar":{"k":"y","after":true,"lead":33},"merge":true},
    {"id":"beast-wars-uprising-copy-6","label":"Beast Wars: Uprising","pos":[305.98,297.28],"colors":["#cccc"],"square":true},
    {"id":"beast-wars-uprising-copy-7","label":"Beast Wars: Uprising","parent":["beast-wars-uprising-copy","array"],"pos":[-424.54,297.21],"colors":["#20242b"],"square":true},
    {"id":"callout-2","label":"sdafsdf","shape":"callout","pos":[-165.34,377.84],"leader":{"from":"beast-wars-uprising-copy","to":"beast-wars-uprising-copy-5","at":0.5,"line":"dashed","shelf":true,"snap":"mid"}},
    {"id":"asdasd-1-copy","label":"Dghdhx{{s:images}}{{s:1000012050}}","parent":"split","colors":["#20242b"],"pos":[-16.16,53.37],"border":"double"},
    {"id":"asdasd-1-copy-2","label":"a","colors":["#20242b"],"pos":[-17.09,187],"tags":["local multiverse"],"square":true},
    {"id":"node","label":"asdsa","shape":"ellipse","pos":[-211.02,-11.79],"colors":["#20242b"],"image":"media/bad8aa8b4beebd4fcc4f408a73a108030482920fd3ce9b6305f2b1fd66acdc61.png","tags":["unreleased"]},
    {"id":"node-2","label":"фыв","shape":"textbox","pos":[-26.11,244.11],"rot":340},
    {"id":"node-3","label":"Прчоао","pos":[-449.05,-124.88]},
    {"id":"node-4","label":"Човьлы","parent":"node-3","pos":[-349.18,102.72]},
    {"id":"node-5","label":"{{#cc22cc|П}}рол{{#20242b|л}}","pos":[-360.15,216.34]},
    {"id":"node-6","label":"Гаягкягкч","parent":"node-5","pos":[-240.23,219.08],"size":[54.13,12.05]},
    {"id":"node-9","label":"TNSDM","pos":[-378.39,501.72]},
    {"id":"node-10","label":"SDWaY!","pos":[-440.97,501.72]},
    {"id":"node-11","label":"","shape":"image","pos":[-300,12],"size":[30.21,30.21],"image":"media/ae476582910cbf9599d2d882d6725d1cb7a4edf5228b942d91135062b4ef718a.gif","anim":"hover"},
    {"id":"node-12","label":"SD","pos":[-398.02,530.17]},
    {"id":"array","label":"","shape":"array","members":["node-9","node-10","node-12"],"bg":["#c2c"],"hatch":"diag-r","border":"dotted"},
    {"id":"callout-3","label":"Рвивт","shape":"callout","pos":[-38.47,81.48],"leader":{"from":"asdasd-copy","to":"beast-wars-uprising-copy-4","at":0.181}},
    {"id":"adjust-animation-toggler-on-gif-s-copy","label":"**Add:** miscellaneous decorative node shapes","pos":[342.38,171.19]},
    {"id":"array-2","label":"","shape":"array","members":["beast-wars-uprising-copy-4","beast-wars-uprising-copy-3","beast-wars-uprising-copy-2"],"hatch":"diag-r","border":"dotted"},
    {"id":"node-7","label":"Amalgam 1","pos":[-654.55,214.58],"card":true},
    {"id":"node-13","label":"Amalgam 3","parent":"node-7","pos":[-649.83,306.24]},
    {"id":"split","label":"","parent":"uprising-copy","shape":"split","pos":[139.37,-32.53],"colors":["#20242b"],"size":[30.21,10.07]},
    {"id":"node-14","label":"","shape":"link","pos":[348.11,372.59],"link":"https://cccarrrottt.github.io/#entry=asdasd"},
    {"id":"node-15","label":"**Rework:** card layout images","pos":[342.38,113.88]},
    {"id":"node-16","label":"**Bug:** commentaries in \"along the line\" mode","pos":[342.38,144.09]}
  ],
  "edgeStyles": [
    {"from":"uprising","to":"uprising-copy","routing":"orthogonal","dash":"solid","arrow":true,"note":"гнгн","color":"#20242b","colorFixed":true,"fromSide":"top","toSide":"top","noteFrame":false,"noteAlongFrame":true},
    {"from":"beast-wars-uprising-copy","to":"beast-wars-uprising-copy-5","routing":"orthogonal","dash":"solid","arrow":true,"color":"#c2c","colorFixed":true,"fromSide":"bottom","toSide":"top"},
    {"from":"beast-wars-uprising-copy-2","to":"beast-wars-uprising-copy-5","routing":"orthogonal","dash":"solid","arrow":true,"arrowIn":true,"barEnd":"tout","fromSide":"bottom","toSide":"top","square":true},
    {"from":"beast-wars-uprising-copy-3","to":"beast-wars-uprising-copy-5","routing":"orthogonal","dash":"solid","arrow":true,"fromSide":"bottom","toSide":"top"},
    {"from":"beast-wars-uprising-copy-4","to":"beast-wars-uprising-copy-5","routing":"orthogonal","dash":"solid","arrow":true,"fromSide":"bottom","toSide":"top"},
    {"from":"beast-wars-uprising-copy-6","to":"beast-wars-uprising-copy-5","routing":"orthogonal","dash":"solid","arrow":true,"fromSide":"bottom","toSide":"top","square":true},
    {"from":"asdasd","to":"asdasd-copy","routing":"orthogonal","dash":"solid","arrow":true,"arrowIn":true,"fromSide":"top","toSide":"top","fromRing":1,"square":true},
    {"from":"beast-wars-uprising-copy","to":"beast-wars-uprising-copy-7","routing":"orthogonal","dash":"solid","arrow":true,"arrowIn":true,"teeIn":true,"bends":[[-206.14,350.56]],"bendSides":["bottom","bottom"],"fromSide":"bottom","toSide":"bottom","square":true},
    {"from":"asdasd-1-copy","to":"uprising","routing":"orthogonal","dash":"double","arrow":true,"fromSide":"right","toSide":"bottom","square":true},
    {"from":"node-5","to":"node-6","routing":"orthogonal","dash":"solid","arrow":true,"fromSide":"top","toSide":"top","square":true},
    {"from":"asdasd-copy","to":"beast-wars-uprising-copy-4","routing":"curve","dash":"solid","arrow":true,"note":"фывфы","notePos":"on","noteAt":0.2198,"gradient":["#2c2","#22c"],"fromSide":"left","toSide":"top","square":true,"noteFrame":false,"noteSquare":true,"noteAlong":true},
    {"from":"array","to":"beast-wars-uprising-copy-7","routing":"orthogonal","dash":"solid","arrow":true,"arrowIn":true,"teeOut":true,"bends":[[-387.91,488],[-362.52,463.22],[-422.94,433.01],[-362.52,392.73],[-422.94,362.52],[-362.52,331.9]],"bendSides":["top","bottom"],"fromSide":"top","toSide":"bottom","square":true},
    {"from":"uprising-copy","to":"split","routing":"curve","dash":"solid","arrow":false,"fromSide":"left"},
    {"from":"split","to":"uprising","routing":"curve","dash":"solid","arrow":true,"toSide":"right"},
    {"from":"split","to":"asdasd-1-copy","routing":"curve","dash":"solid","arrow":true,"fromSide":"bottom","toSide":"bottom","square":false},
    {"from":"","to":"beast-wars-uprising-copy-5","routing":"orthogonal","dash":"solid","arrow":true,"bends":[[70.69,377.64]],"bendSides":["bottom","top"],"toSide":"left","square":true},
    {"from":"node-3","to":"node-4","routing":"orthogonal","dash":"solid","arrow":true,"color":"#20242b","colorFixed":true,"fromSide":"bottom","toSide":"top"},
    {"from":"node-7","to":"node-13","routing":"orthogonal","dash":"solid","arrow":true,"fromSide":"bottom","toSide":"top","square":true}
  ],
  "stickers": [
    {"key":"images","name":"images","src":"media/88dca481176dfc036576689788c3f7d740b50a61cf9f0726bd72ab1a24690603.png"},
    {"key":"1000012050","name":"1000012050","src":"media/45be8b64d0aa9535656e04c8c882598eeaa6172f63761a5d63b75f88d0c2d788.gif"}
  ],
  "media": [
    {"key":"nagahurt","name":"NagaHurt","kind":"video","src":"media/daf23fc6822c84f85fd103a5730f5ec7f74fcf254cc2b80073f52394b37608b5.webm"}
  ],
  "comments": [],
  "tagCats": [
    {"name":"__ungrouped__","tags":["unreleased","fan-fiction"]}
  ],
  "refs": [
    {"key":"ref","title":"","detail":"жэ","url":"https://github.com/cccarrrottt/cccarrrottt.github.io"},
    {"key":"ref-2","title":"","detail":"ываыав"},
    {"key":"sdfsdf","title":"","detail":"sdfsdf"},
    {"key":"zxczcxczx","title":"","detail":"zxczcxczx"},
    {"key":"12132","title":"","detail":"12132"}
  ],
  "settings": {"refColor":"#c23b22"}
}
